{
  "$schema": "https://json-schema.org/draft/2020-12/schema",
  "$id": "https://foodtransparency.uk/schemas/ingredient.schema.json",
  "title": "Ingredient entity",
  "description": "An ingredient record (DATA-11). Metadata fields (id, slug, name, synonyms, eNumber) are plain scalars. Fact-bearing fields reuse the SourcedValue envelope by $ref (DATA-09). The GB regulatory-position field is marked claimDomain regulatory for the TRUST-06 gate. Ingredient pages are descriptive in v1 (INGR-02): no health-effect synthesis is modelled. Verification and publication status are reserved for the Phase 2 gate (DATA-11).",
  "type": "object",
  "additionalProperties": false,
  "required": ["id", "slug", "name"],
  "properties": {
    "id": {
      "type": "string",
      "description": "Stable identifier for the ingredient.",
      "pattern": "^[a-z0-9][a-z0-9-]*$"
    },
    "slug": {
      "type": "string",
      "description": "URL slug.",
      "pattern": "^[a-z0-9][a-z0-9-]*$"
    },
    "name": {
      "type": "string",
      "description": "Ingredient display name."
    },
    "synonyms": {
      "type": "array",
      "items": { "type": "string" },
      "description": "Alternative names this ingredient is known by."
    },
    "eNumber": {
      "type": "string",
      "description": "Optional E number where the ingredient is a regulated additive."
    },
    "functionDescription": {
      "$ref": "sourced-value.schema.json",
      "description": "Fact-bearing: a descriptive account of what the ingredient does, sourced."
    },
    "authorityPosition": {
      "$ref": "sourced-value.schema.json",
      "description": "Optional (INGR-02 'may state'): a named authority's published safety opinion (FSA, EFSA or SACN), cited and dated. A fact-bearing SourcedValue, DISTINCT from regulatoryStatus. Deliberately NOT claimDomain regulatory (D-14): an EFSA or SACN opinion is not the GB regulatory status and may not be GB-jurisdiction, so it must not trigger the TRUST-06 GB-source and checkedOn referential rule. Ingredient pages stay descriptive: this cites a position, it does not synthesise studies (EVID-SYNTH-01 deferred). Optional, so existing records validate unchanged."
    },
    "regulatoryStatus": {
      "description": "Fact-bearing regulatory-position field. Marked claimDomain regulatory so the TRUST-06 referential gate (plan 01-05) can key on it.",
      "allOf": [
        { "$ref": "sourced-value.schema.json" },
        {
          "type": "object",
          "properties": { "claimDomain": { "const": "regulatory" } },
          "required": ["claimDomain"]
        }
      ]
    },
    "verificationStatus": {
      "enum": [null],
      "description": "Derived-only entity status (D-03/R-06): computed from the entity's facts every build, so any author-set value is rejected by Ajv. Only null validates."
    },
    "publicationStatus": {
      "enum": [null],
      "description": "Derived-only entity status (D-03/R-06): computed from the entity's facts every build, so any author-set value is rejected by Ajv. Only null validates."
    }
  }
}
